{
  "symbol": "USDT",
  "name": "USDT@VinuChain",
  "address": "0xC0264277fcCa5FCfabd41a8bC01c1FcAF8383E41",
  "decimals": 6,
  "chainId": 207,
  "description": "Bridged Tether (USDT) stablecoin on VinuChain, providing a stable USD-pegged asset for trading and DeFi applications.",
  "logoURI": "https://raw.githubusercontent.com/VinuChain/vinuchain-lists/main/tokens/0xC0264277fcCa5FCfabd41a8bC01c1FcAF8383E41/0xC0264277fcCa5FCfabd41a8bC01c1FcAF8383E41.png",
  "website": "https://tether.to",
  "coingecko": "https://www.coingecko.com/en/coins/tether",
  "coinmarketcap": "https://coinmarketcap.com/currencies/tether/"
}
