{
  "symbol": "VINU",
  "name": "Vita Inu",
  "address": "0x00c1E515EA9579856304198EFb15f525A0bb50f6",
  "decimals": 18,
  "chainId": 207,
  "description": "Bridged VINU on VinuChain, bringing the vibrant community and innovative features of Vita Inu to the VinuChain ecosystem.",
  "project": "vitainu",
  "logoURI": "https://s2.coinmarketcap.com/static/img/coins/64x64/15270.png",
  "website": "https://vitainu.org",
  "support": "hello@vitainu.org",
  "github": "https://github.com/vita-inu",
  "twitter": "https://x.com/vitainucoin",
  "telegram": "https://t.me/vitainu",
  "discord": "https://discord.gg/vinu",
  "medium": "https://medium.com/vitainu",
  "linkedin": "https://linkedin.com/company/vinufoundation/",
  "instagram": "https://instagram.com/vitainucoin",
  "facebook": "https://facebook.com/vitainucoin",
  "reddit": "https://reddit.com/r/vitainu",
  "youtube": "https://www.youtube.com/c/vitainucoin",
  "coingecko": "https://www.coingecko.com/en/coins/vita-inu",
  "coinmarketcap": "https://coinmarketcap.com/currencies/vita-inu/",
  "codeHash": "0xa6403bce53bd1535cb9ed52014b0ce547bb262fd1c739a03c8949de586f6643c"
}
